[
  {
    "confidence": 0.86,
    "constraints": {
      "no_invented_steps": true
    },
    "docs_gate": "BLOCKED",
    "evidence_class": "mixed",
    "export_targets": [
      "hybrid_legal_dsl"
    ],
    "id": "notation_transport:hybrid_legal_dsl",
    "inputs": [
      "canonical_operator_chain"
    ],
    "kind": "notation_transport",
    "notation_class": "legal",
    "notation_id": "hybrid_legal_dsl",
    "outputs": [
      "hybrid_legal_dsl"
    ],
    "source_carrier": "canonical_operator_chain",
    "source_refs": [
      "FULL_TRANSLATION/framework/registry/lenses.json",
      "FULL_TRANSLATION/framework/registry/math_kernel_registry.md",
      "FULL_TRANSLATION/manuscripts/MASTER_VOYNICH_SYNTHESIS_ROSETTA_STONE.md"
    ],
    "source_unit": "hybrid_legal_dsl",
    "target_carrier": "lawful transform packet",
    "target_fields": [
      "preconditions",
      "carrier",
      "allowed_transform",
      "boundary_checks",
      "checkpoint_rule",
      "completion_rule",
      "rollback_rule"
    ],
    "transform": {
      "transport_law": "canonical packet to target notation"
    },
    "transport_law": "canonical packet to target notation"
  },
  {
    "confidence": 0.86,
    "constraints": {
      "no_invented_steps": true
    },
    "docs_gate": "BLOCKED",
    "evidence_class": "mixed",
    "export_targets": [
      "json_schema"
    ],
    "id": "notation_transport:json_schema",
    "inputs": [
      "canonical_operator_chain"
    ],
    "kind": "notation_transport",
    "notation_class": "code",
    "notation_id": "json_schema",
    "outputs": [
      "json_schema"
    ],
    "source_carrier": "canonical_operator_chain",
    "source_refs": [
      "FULL_TRANSLATION/framework/registry/lenses.json",
      "FULL_TRANSLATION/framework/registry/math_kernel_registry.md",
      "FULL_TRANSLATION/manuscripts/MASTER_VOYNICH_SYNTHESIS_ROSETTA_STONE.md"
    ],
    "source_unit": "json_schema",
    "target_carrier": "JSON Schema",
    "target_fields": [
      "program",
      "line_programs",
      "canonical_chain_digest"
    ],
    "transform": {
      "transport_law": "canonical packet to target notation"
    },
    "transport_law": "canonical packet to target notation"
  },
  {
    "confidence": 0.86,
    "constraints": {
      "no_invented_steps": true
    },
    "docs_gate": "BLOCKED",
    "evidence_class": "mixed",
    "export_targets": [
      "python"
    ],
    "id": "notation_transport:python",
    "inputs": [
      "canonical_operator_chain"
    ],
    "kind": "notation_transport",
    "notation_class": "code",
    "notation_id": "python",
    "outputs": [
      "python"
    ],
    "source_carrier": "canonical_operator_chain",
    "source_refs": [
      "FULL_TRANSLATION/framework/registry/lenses.json",
      "FULL_TRANSLATION/framework/registry/math_kernel_registry.md",
      "FULL_TRANSLATION/manuscripts/MASTER_VOYNICH_SYNTHESIS_ROSETTA_STONE.md"
    ],
    "source_unit": "python",
    "target_carrier": "Python function",
    "target_fields": [
      "program",
      "line_programs",
      "canonical_chain_digest"
    ],
    "transform": {
      "transport_law": "canonical packet to target notation"
    },
    "transport_law": "canonical packet to target notation"
  },
  {
    "confidence": 0.86,
    "constraints": {
      "no_invented_steps": true
    },
    "docs_gate": "BLOCKED",
    "evidence_class": "mixed",
    "export_targets": [
      "typescript_javascript"
    ],
    "id": "notation_transport:typescript_javascript",
    "inputs": [
      "canonical_operator_chain"
    ],
    "kind": "notation_transport",
    "notation_class": "code",
    "notation_id": "typescript_javascript",
    "outputs": [
      "typescript_javascript"
    ],
    "source_carrier": "canonical_operator_chain",
    "source_refs": [
      "FULL_TRANSLATION/framework/registry/lenses.json",
      "FULL_TRANSLATION/framework/registry/math_kernel_registry.md",
      "FULL_TRANSLATION/manuscripts/MASTER_VOYNICH_SYNTHESIS_ROSETTA_STONE.md"
    ],
    "source_unit": "typescript_javascript",
    "target_carrier": "TypeScript/JavaScript function",
    "target_fields": [
      "program",
      "line_programs",
      "canonical_chain_digest"
    ],
    "transform": {
      "transport_law": "canonical packet to target notation"
    },
    "transport_law": "canonical packet to target notation"
  },
  {
    "confidence": 0.86,
    "constraints": {
      "no_invented_steps": true
    },
    "docs_gate": "BLOCKED",
    "evidence_class": "mixed",
    "export_targets": [
      "rust"
    ],
    "id": "notation_transport:rust",
    "inputs": [
      "canonical_operator_chain"
    ],
    "kind": "notation_transport",
    "notation_class": "code",
    "notation_id": "rust",
    "outputs": [
      "rust"
    ],
    "source_carrier": "canonical_operator_chain",
    "source_refs": [
      "FULL_TRANSLATION/framework/registry/lenses.json",
      "FULL_TRANSLATION/framework/registry/math_kernel_registry.md",
      "FULL_TRANSLATION/manuscripts/MASTER_VOYNICH_SYNTHESIS_ROSETTA_STONE.md"
    ],
    "source_unit": "rust",
    "target_carrier": "Rust function",
    "target_fields": [
      "program",
      "line_programs",
      "canonical_chain_digest"
    ],
    "transform": {
      "transport_law": "canonical packet to target notation"
    },
    "transport_law": "canonical packet to target notation"
  },
  {
    "confidence": 0.86,
    "constraints": {
      "no_invented_steps": true
    },
    "docs_gate": "BLOCKED",
    "evidence_class": "mixed",
    "export_targets": [
      "c"
    ],
    "id": "notation_transport:c",
    "inputs": [
      "canonical_operator_chain"
    ],
    "kind": "notation_transport",
    "notation_class": "code",
    "notation_id": "c",
    "outputs": [
      "c"
    ],
    "source_carrier": "canonical_operator_chain",
    "source_refs": [
      "FULL_TRANSLATION/framework/registry/lenses.json",
      "FULL_TRANSLATION/framework/registry/math_kernel_registry.md",
      "FULL_TRANSLATION/manuscripts/MASTER_VOYNICH_SYNTHESIS_ROSETTA_STONE.md"
    ],
    "source_unit": "c",
    "target_carrier": "C function",
    "target_fields": [
      "program",
      "line_programs",
      "canonical_chain_digest"
    ],
    "transform": {
      "transport_law": "canonical packet to target notation"
    },
    "transport_law": "canonical packet to target notation"
  },
  {
    "confidence": 0.86,
    "constraints": {
      "no_invented_steps": true
    },
    "docs_gate": "BLOCKED",
    "evidence_class": "mixed",
    "export_targets": [
      "cpp"
    ],
    "id": "notation_transport:cpp",
    "inputs": [
      "canonical_operator_chain"
    ],
    "kind": "notation_transport",
    "notation_class": "code",
    "notation_id": "cpp",
    "outputs": [
      "cpp"
    ],
    "source_carrier": "canonical_operator_chain",
    "source_refs": [
      "FULL_TRANSLATION/framework/registry/lenses.json",
      "FULL_TRANSLATION/framework/registry/math_kernel_registry.md",
      "FULL_TRANSLATION/manuscripts/MASTER_VOYNICH_SYNTHESIS_ROSETTA_STONE.md"
    ],
    "source_unit": "cpp",
    "target_carrier": "C++ function",
    "target_fields": [
      "program",
      "line_programs",
      "canonical_chain_digest"
    ],
    "transform": {
      "transport_law": "canonical packet to target notation"
    },
    "transport_law": "canonical packet to target notation"
  },
  {
    "confidence": 0.86,
    "constraints": {
      "no_invented_steps": true
    },
    "docs_gate": "BLOCKED",
    "evidence_class": "mixed",
    "export_targets": [
      "java"
    ],
    "id": "notation_transport:java",
    "inputs": [
      "canonical_operator_chain"
    ],
    "kind": "notation_transport",
    "notation_class": "code",
    "notation_id": "java",
    "outputs": [
      "java"
    ],
    "source_carrier": "canonical_operator_chain",
    "source_refs": [
      "FULL_TRANSLATION/framework/registry/lenses.json",
      "FULL_TRANSLATION/framework/registry/math_kernel_registry.md",
      "FULL_TRANSLATION/manuscripts/MASTER_VOYNICH_SYNTHESIS_ROSETTA_STONE.md"
    ],
    "source_unit": "java",
    "target_carrier": "Java method",
    "target_fields": [
      "program",
      "line_programs",
      "canonical_chain_digest"
    ],
    "transform": {
      "transport_law": "canonical packet to target notation"
    },
    "transport_law": "canonical packet to target notation"
  },
  {
    "confidence": 0.86,
    "constraints": {
      "no_invented_steps": true
    },
    "docs_gate": "BLOCKED",
    "evidence_class": "mixed",
    "export_targets": [
      "html"
    ],
    "id": "notation_transport:html",
    "inputs": [
      "canonical_operator_chain"
    ],
    "kind": "notation_transport",
    "notation_class": "code",
    "notation_id": "html",
    "outputs": [
      "html"
    ],
    "source_carrier": "canonical_operator_chain",
    "source_refs": [
      "FULL_TRANSLATION/framework/registry/lenses.json",
      "FULL_TRANSLATION/framework/registry/math_kernel_registry.md",
      "FULL_TRANSLATION/manuscripts/MASTER_VOYNICH_SYNTHESIS_ROSETTA_STONE.md"
    ],
    "source_unit": "html",
    "target_carrier": "HTML article",
    "target_fields": [
      "program",
      "line_programs",
      "canonical_chain_digest"
    ],
    "transform": {
      "transport_law": "canonical packet to target notation"
    },
    "transport_law": "canonical packet to target notation"
  },
  {
    "confidence": 0.86,
    "constraints": {
      "no_invented_steps": true
    },
    "docs_gate": "BLOCKED",
    "evidence_class": "mixed",
    "export_targets": [
      "react_tsx"
    ],
    "id": "notation_transport:react_tsx",
    "inputs": [
      "canonical_operator_chain"
    ],
    "kind": "notation_transport",
    "notation_class": "code",
    "notation_id": "react_tsx",
    "outputs": [
      "react_tsx"
    ],
    "source_carrier": "canonical_operator_chain",
    "source_refs": [
      "FULL_TRANSLATION/framework/registry/lenses.json",